
Silk is talking about how famous her rivals are in the Galaxy League. She seems jealous. Let's talk to her.	
You're as good as they are, I'd say you desrve more credit.	
Good rivalry brings both sides to higher levels.	3
I'll be your rival from now.	
Silk	
Silk says she's the center of the team and asks if you agree with her. How should we answer?	
Of course! Everybody is counting on you!	3
Well, your sarcastic jokes are an essential part of the team's strength.	
I'm sure that you're being a good influence to the team.	1
Silk	
You enter the lodging feeling lonely on your birthday. The team greets you with a surprise and Silk hands you a present.	
(A cute and pretty pendant)	3
(A surprise box! Inside it there's a cool wallet.)	
(A chocker with a pretty radical design.)	
Silk	
Kuma is furiously chasing Ogre. Silk seems confused.	
Two bears...Which one is Kuma?	-1
Well, one thing is for sure. One of them did something stupid.	-1
Looks like Orge is goofing around. I mean the guy has like over 200 pounds over Kuma.	
Silk	
Silk is interested in Selena and is asking for your opinion. What should we say?	
She's kind and sweet. Maybe you'll have a shot?	3
Be honest and show a sincere attitude.	
Considering your personality, I think she'll accept you.	-1
Silk	
Silk says that she thinks Alkyde looks at Fontus in a funny way. Let's give her an answer.	
That's a mixture of mockery, sympathy and love.	-1
I think she likes him.	
Maybe she's up to something.	-1
	
Princess Meiran	
The match and the concert that Princess Meiran was looking for start at the same time...	
Let's hack the big screen so we can see the concert!	1
Channel that sorrow and rage towards your opponents and make them pay.	
I'm sorry that you couldn't go.	
Princess Meiran	
Princess Meiran won a trip around the world from a radio event!	
What about soccer? You'll have to go through me to go on that trip	
Hmm, come back to me with a vacation plan.	3
...World? What about space? Isn't that more interesting?	
Princess Meiran	
Princess Meiran seems to be worried about one of the team members that left after a quarrel. Let's talk to her.	
Everybody should grow up.	
It'll be alright. Don't worry.	-1
Le's go look for her. 	
Princess Meiran	
MX54 Butcher is closing in on a cat with a suspicious smile.	
Stop right there!	
Excuse me, but do you have an appointment with that cat?	3
...Maybe he just likes cats!	
Princess Meiran	
Princess Meiran is having trouble deciding a name for her special move. Her options are ''Infinity Illusion Shot'', ''11th Dimension Ultra Gravity Shot'', ''Astral Space Shot'', and a few more.	
I'm sure you're going to become an intergalactic fool.	3
I...Respect your naming taste...	-1
Cool! Keep it up!	
Princess Meiran	
Princess Meiran is all alone in the locker room worrying about the fate of the universe. Let's go talk to her.	
It's silly of you to worry about such things. Are you feeling okay?	
We must have faith in the Gate Keeper and win the Galaxy League.	3
A mysterious villain... Bad taste, if you ask me.	
Princess Meiran	
Princess Meiran isn't pleased with the team's recent plays. She feels that the plays have become somewhat repetitive and dull.	
Let's all talk together and figure out what problem is.	3
Let's invest some Crystals and get new players!	
We may have to go rough on the team and make them realize the problem.	
Princess Meiran	
Princess Meiran seems to be thinking that the team has already become the best in the universe. She seems a bit too carried away. What should you do?	
It's within our grasp.	3
I would like to hear what you think is the best team in the universe.	1
Stick a thumb up and do a comedic dance just for the sake of laughter.	-1
Princess Meiran	
You're talking to Princess Meiran about what you would do if the world ends tomorrow. Let's tell her your answer.	
I would say goodbye to all my friends.	3
If it's the end of the world, I'd pull of a crazy performance in a densely populated area before I go!	-1
Hmm, there's a guy I'd like to beat up before I die.	1
Princess Meiran	
Princess Meiran is blaming the team for their pass mistakes and is questioning their soccer skills.	
This needs to be analyzed and fixed.  Can you help me?	3
Passes that you prefer aren't always the right answer.	1
It can't be perfect every time.	
Princess Meiran	
You forgot to lock Princess Meiran and almost used her as training material! She looks very upset!	
It's my fault	3
It was all just to motivate you to become a better player!	
It's your fault.	
Princess Meiran	
Princess Meiran is asking about my ideal type of person. Should be careful about answering this...	
I have very specific standards for personality, looks, values, and background. Are you interested in hearing about it?	1
I'm all about the feeling. A spark is all it takes.	-1
I think that being able to understand each other is the most important.	3
Princess Meiran	
This was the worst game in your entire life...Princess Meiran comes to you to cheer you up.	
Please explain why you kicked the ball into our goal post, will you?	
Thanks...I know you're the one that's the most devastated...Let's do better next time.	
Thanks. You always know how to get me back on my feet.	3
Princess Meiran	
You're sick and in bed when Princess Meiran and the teammates come to cheer you up. What will your response be?	
You guys... I'm about to cry...	
I'm sorry... I should be giving you guys tea or something, but...	3
Get closer so I can spread my germs!	
Princess Meiran	
Princess Meiran thinks she knows who Lynbell's brother is. What should we do?	
First, let's look for a way to bring him back to normal.	3
Of course we should tell Lynbell! What are you waiting for?	
...Sometimes, the truth is better to be left a secret.	-1
Princess Meiran	
According to Princess Meiran's words, Tyler went to school 1 year earlier than William.	
I want to see Tyler's true characteristics.	1
William doesn't know how to respect his seniors.	-1
I thought they were just friends.	
Princess Meiran	
There's been a mistake. The team's uniform is mixed up with the festival costumes. What should you tell the team?	
What's done is done. Let's come up with a new design.	1
It's finally time for some festival-soccer!	-1
Let's split up and find the uniforms.	
Princess Meiran	
The opponent team barges into the field and mocks your team saying your team is better off playing foot volleyball.	
Let's see what you have to say after the match.	3
I didn't know I was a talented foot volleyball player!	
Care to receive the ball with your face?	
Princess Meiran	
Princess Meiran is complaining that it's boring to play only soccer every day. What should we say to her?	
How about we play baseball today?	-1
No, it's not boring.	3
If you're up for suggestions, I'm all ears.	1
Princess Meiran	
Princess Meiran is asking you about the one thing you want the most in the universe. What do you tell him?	
(I want everyday to be exciting and fun.)	
(I don't want to waste a single day in my life.)	3
(I want my dreams to come true.)	-1
Princess Meiran	
With back to back matches, the team is exhausted. Let's talk to Princess Meiran for solutions.	
We won't be able to win league if we fail to overcome this. 	1
I guess its time the benchwarmers get a chance. 	3
How about we put that advanced technology of Metro City to use?	
Princess Meiran	
On a day off, Princess Meiran is looking at a passing couple with jealous eyes.	
Id love to have a stable job first.	
Its really hard to find the right person.	1
If you find a handsome man, try talking to him!	1
Princess Meiran	
Princess Meiran is talking with the team about what they would be doing if they didn't start soccer. Let's join them.	
I would've tried to find something that fits me.	
Something full of excitement!	
I would've been doing something to save the universe.	3
Princess Meiran	
Princess Meiran is asking about the team's goal of this season. What should you tell her?	
To win all the way, of course.	-1
Best of 4 should be our goal.	3
Teamwork is what matters the most.	
Princess Meiran	
It's before the 2nd half, and Princess Meiran is complaining that we're up against an opponent that's too strong.	
We should at least put up a fight so they remember us.	
There's nothing we can really do. Let's just get this over with.	
Don't give up until the end.	3
Princess Meiran	
Princess Meiran suggests that we visit the Celestial Castle, which is a place that the baby angels live.	
What's the agenda here? Are you trying to taint the pure angels?	
This is a good chance to show the baby angels how rough soccer can be!	-1
That would be wonderful! I'll go ask for permission.	3
Princess Meiran	
Princess Meiran is arrogantly looking down at the other team. Let's stop her from causing any problems.	
You're right. This is a waste of time.	
The honor of our opponent is also important.	3
That team is far from your style.	1
Princess Meiran	
Princess Meiran is training hard to become scouted like the players that moved to teams that offered better conditions. Let's give her some advice.	
I hope you get scouted by an interesting team.	1
Make the scouters fall in love with your performance.	1
Let's make that our goal and make it happen.	
Princess Meiran	
Princess Meiran is making a scene. She'd rather jump into space than to be eaten alive by vicious aliens.	
Vicious? More like ugly.	
The door's over there.	-1
Are you giving up before putting up a fight?	3
Princess Meiran	
The team manger ran away with all of the team's money. What should we do?	
We could start a reset marathon.	
We're going to hunt that manager down and take back our money. We will show no mercy!	-1
Let's ask for help to the League officials on this planet.	3
Princess Meiran	
You were taking a walk in the Nadir forest with Princess Meiran and came across Enthia standing in the middle of a burnt part of the forest.	
Let's give her some space.	3
I could really use some grilled sweet potatoes and chestnuts.	
There's no time for tears! Find out who did this and bring justice!	-1
Princess Meiran	
Does one have to make intentional fouls in order to win? Let's give her some advice.	
Is winning really worth going that far?	1
I don't see anything wrong as long as you can get away with it.	-1
Be true to yourself.	
Princess Meiran	
The match started and Princess Meiran is standing still doing nothing.	
What is she doing?  Is she a totem?	
Run!  Just start running!	-1
Looks like we'll have to do without her.	3
Princess Meiran	
Princess Meiran is looking excited and asks how the match went.	
The other team went home crying!	
They were a worthy opponent.	3
I led our team to victory with wedgies!	
Princess Meiran	
Princess Meiran is worried about all of the powerful beings that will be competing in the Galaxy League. Let's say something to her.	
It's only a sport! The strongest team wins, and we are strong!	1
I'm sure everyboby is feeling the same way you feel.	
Aren't you the one everyboby should be afraid of?	
Princess Meiran	
The team is saying bad things about Princess Meiran for skipping practice. Time to intervene.	
Do you really think that she would skip practice?	3
Skipping practice isn't something that's in her dictionary.	1
Her love towards soccer is real.	
Princess Meiran	
Princess Meiran wonders why Castor twitches whenever he sees Beatrice.	
Long ago, he was disgraceful towards a dragon emissary.	3
The character story left him a trauma.	
Maybe he just wants to duke it out.	
	
Vivid Fear	
Mortor and Wizol of the Peacemakers are helping an old man. Vivid Fear seems to be surprised.	
Well, what do you know! They have some decency in them after all.	
Hmmm.	1
It's good to know that they're not shallow people.	3
Vivid Fear	
It's a very intense match and Vivid Fear falls on the ground, but a player on the other team helps Vivid Fear up and the two exchange smiles.	
Guess the match isn't tough for you, huh?	
True sportsmanship! Wonderful!	-1
That player must have a heart of gold.	
Vivid Fear	
Cracsus threatens to hack Vivid Fear's personal information and reveal it to the world. What should we do?	
Let's blackmail Robin that we;ll pluck out all of his plants.	-1
I contacted Hildegard.	-1
Don't fall for this cheap shot.	
Vivid Fear	
The team will not have a match for some time. Vivid Fear asks you about your plan.	
We could ask one of the top teams for a friendly match.	1
Hmm, wanna go shopping?	
I have a very hard training session all planned up for everybody	3
Vivid Fear	
The team made it up to the semi-finals after counting the goal differences. Vivid Fear asks how you feel. How should we answer?	
What, are you expecting something like "I feel like I can fly" or something?	3
This is where things get serious. We're going to win!	1
Wow. I'm sooooo happy.	-1
Vivid Fear	
Vivid Fear is impressed by the help she received from the elementals. Let's talk to her.	
The only problem is that they take up a lot of space in the inventory.	3
I feel like the whole universe is cheering for us when we're with the elementals!	
I am so thankful to them.	-1
Vivid Fear	
A big fight broke out between an angel and a demon within the team. Vivid Fear is asking for help.	
I'm going to pick sides of the one I like.	3
I hope the demon didn't say anything stupid.	
Maybe the angel did something irritating again.	1
Vivid Fear	
The teammates are speaking highly of Vivid Fear, saying she's a good role model. Let's add in.	
Thank you for doing whatever it takes to win.	
She shows dominance with elegance.	3
She's truly a role model to us all with her skills and attitude.	
Vivid Fear	
A player on the other side is on the field with his arms tied up. Let's talk about this with Vivid Fear.	
I feel like he's mocking us!	1
It hurts when the whip first crackles. And the pain just keeps ramping up.	-1
He still has his two legs functioning. I see no problem with that.	3
Vivid Fear	
You visit the practice field of your next opponent and feel very sorry about their not-so-good financial situation. What should we do?	
I feel sorry, but that's irrelevant to the match.	
This is going to be a cake walk.	
I'm considering making an anonymous donation.	3
Vivid Fear	
Vivid Fear brought a drink that she says received from the coach on the other team. It looks very suspicious especially with the dark fumes coming out of it.	
The drink looks really scary...But we can't just throw it away...	
Throw it away. NOW.	3
Drink it up!	
Vivid Fear	
Vivid Fear, who is always suspicious of you, has you in the corner and is demanding that you reveal who you really are. What should we answer?	
To become the strongest being in space! I shall tramp on everything that stands in my path!	1
Just playing soccer, that's all.	3
To bring justice with soccer. That's all.	
Vivid Fear	
Vivid Fear lost to the opponent and fell to the ground. What should we do?	
This doesn't look good... Can anybody give him some heals?	
Well, this could all have been prevented if you consumed those Swirlies like I told you...	3
I will avenge you!	
Vivid Fear	
Vivid Fear is asking you if you ever saw the World Tree. Let's tell her your thoughts.	
Let's not talk about anything irrelevant to the match.	
It's something I'd want to see again with a person i care.	-1
It's nothing but a tree.	
Vivid Fear	
Vivid Fear points out that the time the men of Minerva died and the time the epidemic broke out in Metro City matches.	
I think that had something to do with dirty money.	
It would disgust me if that was the result of an evil plot.	3
That's too convenient it be a coincidence.	
Vivid Fear	
You come across Vivid Fear, who was overwhelmed by her opponent throughout the game. Let's cheer her up.	
Those scumbags played dirty. Ugh, I'm angry!	
I should step on the player's foot next time. 	-1
I'm proud that you played your game and didn't descend to the opponents level.	3
Vivid Fear	
Vivid Fear falls to the ground after clashing with the opponent. What should we say to her?	
If that's all you've got, just stay down. It's okay.	
Get up! The game's not over! You better not give up!	-1
Well, let's start by dropping that player's HP to 1.	-1
Vivid Fear	
Vivid Fear suggests that we have a team dinner to lighten things up. What will be your reaction?	
How about we go eat salad? I'm on a diet.	
How could you think about eating at a time like this? I'm disappointed in you.	3
Good idea. Let's go eat some meat!	-1
Vivid Fear	
You come across Sammy while walking the street with Vivid Fear. Let's talk to her.	
We'll win next time!	
Do you also do fortune telling? I think I'm in love.	
(Ignore.)	3
Vivid Fear	
As Vivid Fear said, the universe is facing a new course of destiny because of the Galaxy League. Let's talk to her.	
I'm sure it's going in a good direction.	
I feel like the universe is heading towards chaos.	3
It's not the Galaxy League. We are the ones that are leading the fate of this universe.	1
Vivid Fear	
Vivid Fear is complaining about a teammate and is asking for your opinion.	
If you're better than your teammates, you should be the on to be considerate.	3
I'm not comfortable with this conversation.	
He can be irritating.	1
Vivid Fear	
Vivid Fear is thinking about what Selena said about saving the galaxy if we win the Galaxy League.	
Then we should do our very best to win.	-1
I can play along if there's something in it for me.	
It's not good to just believe what others say.	
Vivid Fear	
Vivid Fear is yelling, ''Our will for soccer is guiding us to victory!''	
Not again...	
Let's do this! I'm at your disposal!	3
I like what you just said	
Vivid Fear	
Half of your team is injured because of an evil plot of your next opponent. What should we do?	
We will confront them fair and square, and win.	
I'll go blow up their lodging.	
Pathetic. We'll show them that we're better in many ways.	3
Vivid Fear	
The crowd is cheering for Vivid Fear. Vivid Fear seems to find this situation new and a bit uncomfortable. Let's help her out.	
They're all in love with your enthusiatic play.	1
They know you gave everything you got. It was spectacular.	
How about just accepting the compliments for today?	
Vivid Fear	
Vivid Fear scored a hat trick and led the team to a complete victory! Congratulate her!	
Hmm? Didn't we win the game when we score the first goal?	
That was awesome! I'm looking forward to seeing more of that!	
You're starting to show the world your true potential! I'm impressed!	-1
Vivid Fear	
You're walking in a narrow ally and come across Vivid Fear having an intense staring contest with the captain of the opposing team. What should we say?	
Save the energy for the match.	-1
How about solving this with a game of rock, scissors, paper?	
...I see two idiots standing in front of me...	
Vivid Fear	
The next opponent is the Lab Rat Entry. You hear that all of the players on the other team are victims of experiments and this makes you feel uncomfortable.	
That's a sad story. I'm tearing up.	
I feel bad for them, but that's no excuse for throwing the game.	3
It would be rude to them if we don't do our best.	
Vivid Fear	
Vivid Fear was watching penguins play soccer and suddenly decided to raise a pet penguin herself. Let's talk to her.	
Oh, that'll be so cute!	
It would be good to have one of each color, and when they're all grown up...Make 'em into a good meal!	3
We can play soccer with the penguins!	
Vivid Fear	
Vivid Fear says to you that it was an honor to be able to play with you. Let's give her an answer.	
Let's do our best until the very end!	
I never imagined that i'd be used like this.	
I'm starting to enjoy playing with you.	3
Vivid Fear	
You're at the Underground to enter a wager match, but you find people who are playing a friendly match.	
How can I earn gold? Where do I have to go to find the REAL Underground?	-1
It's sort of an obligation for first class athletes like me to mingle with the community.	
So, there are no real illegal matches. I guess I'm relieved.	-1
Vivid Fear	
Vivid Fear is surrounded by fans and seems to be overwhelmed. Let's talk to her.	
I hope this won't affect your performance in the field.	3
The fans love your performance!	
Should've practiced that autograph like I told you.	
Elizabeth	
Elizabeth says that she thinks Alkyde looks at Fontus in a funny way. Let's give her an answer.	
That's a mixture of mockery, sympathy and love.	3
I think she likes him.	-1
Maybe she's up to something.	-1
Elizabeth	
Elizabeth claims she saw Sophie of team Atlanta coming out of the men's room. What could be the case?	
She must've made a mistake.	1
Maybe Sophie is actually a male..?	1
I don't care what the case is.	
Elizabeth	
Elizabeth went to take a look at the opponent team and got caught. What should we do?	
We should think about how to make fun of her when she comes back.	
I feel sorry for the other team.	
Elizabeth is in danger! We have to save her!	-1
Elizabeth	
Elizabeth says she was cornered by the team which was devastated by the loss streak.	
Tell them they should remember that they play for you.	3
Just hear them out and smile. They'll feel better.	1
You can point out their mistakes and flaws but still keep things humorous. Just don't go too sarcastic on them.	-1
Elizabeth	
Elizabeth says she's the center of the team and asks if you agree with her. How should we answer?	
Of course! Everybody is counting on you!	
Well, your sarcastic jokes are an essential part of the team's strength.	
I'm sure that you're being a good influence to the team.	3
Elizabeth	
You witness Fontus, the most violent and powerful creature in the universe, flying the night sky in a Santa costume.	
...The stress has finally got to him. It must be that...	3
Ugh...I want to dig my eyes out.	
Fontus...You sure are my archnemesis!	
Elizabeth	
Elizabeth wants to know what the Swirlies really are. Give her an answer.	
Beginner level monsters in an RPG game.	
Thankful beings that will be our +160.	3
I'm planning to make a whole line of merchandise with them as the character	
Elizabeth	
Elizabeth wants to hear about your plans on training the new players. What should we answer?	
Perfect planning and perfect execution	1
All goes as planned....Hmm? Just ignore that.	
Why don't you join them and find out?	3
Elizabeth	
It's a throwing chance, but the opponent team player suddenly jumps in joy saying his baby brother is born. What should you do?	
I could throw the ball and continue the match, but my honor wouldn't allow that.	
I guess I finally get to meet my archnemesis.	
Wow, congratulations! (Claps)	3
Elizabeth	
Elizabeth seems very nervous to confront Kei of the Rescuer.	
Be careful not to be stomped on...	3
We can do this! Let's go!	-1
Don't be nervous! Don't you trust your teammates?	-1
Elizabeth	
The rain has messed up the field and the enemy team seems to be determined to crush your team.	
I can't stand this...I need to end this quickly and go take a shower.	
What a depressing weather...	
Well, if it's a muddy dog fight they want, let's give it to them!	3
Elizabeth	
Elizabeth is suddenly showing massive improvement in her performance. She must've learned something during a match.	
Impressive! You're the ace of this team now!	3
You've become better. Now you need to focus on staying that way.	
I knew this day would come.	
Elizabeth	
Elizabeth seems to get along with the opponent player. What should we tell her?	
Congratulations! How did you guys get along?	-1
Don't forget that we exist! Haha!	
Good for you! I know it's hard for you to find someone at your level!	3
Elizabeth	
Ogre's pony tail slapped Elizabeth in the face!	
Even his hair is a weapon! Is that even allowed? 	
That must hurt.	3
Ugh...Gross...	1
Elizabeth	
Elizabeth says that the captain of team Scout Entry seems to take good care of the team members.	
Well, I'm better than him because I'm in love with this team.	
That's strange. I thought he was more of an authoratative character.	3
Yeah, they get along pretty well.	1
Elizabeth	
Elizabeth says she's having trouble dealing with the young players. Let's give her an answer.	
They're young but they have passion.	3
Yeah, I mean they could get hurt.	
Teach them how adults play soccer.	
Elizabeth	
Elizabeth says she's going to meet up with Kiki and asks if you have any questions.	
Is her name really Kiki?	
Ask her if she likes you and if she wants to join our team.	3
Tell her to be our lap cat.	
Elizabeth	
Elizabeth is saying that the universe needs more than stars to brighten it up. Let's talk to her.	
Life is a light of its own.	1
That's deep. I think it's cool.	
How about we make it to the top of the Galaxy League and shine the universe with the light within us?	3
Elizabeth	
Elizabeth is asking who you think of first when you win a match. Let's answer.	
My teammates and their flawless play!	1
My friends from previous life... They would be pleased to see me win.	-1
My fans!	
Elizabeth	
Elizabeth picked up a diary. It says Bell on the cover.	
So, this is how the revelation begins!	
Oh, I'm sure going to read this! That's a joke, of course...	3
Let's contact her and return this.	
Elizabeth	
This match will be held on Earth. We still have some time. What do you want to do?	
Well, I could show you around and introduce you to the things on Earth.	3
I heard that the bath products on Earth are the best in the universe.	
I'm going to check out the new comic issues. Wanna come along?	
Elizabeth	
Elizabeth looks excited to see a comet shower, which is a rare sight. What should we say to her?	
Where do you think those comets are going?	
Do you think any of those comets are populated?	
The space has prepared this beautiful stage for you.	3
Elizabeth	
Elizabeth is deeply focused on Jill's diet story. What should we do?	
I don't think you need to worry about a diet.	3
You're playing soccer! You're fine!	-1
Please don't forget about the match.	
Elizabeth	
Elizabeth is having a delightful chat with a girl that's holding a turtle.	
You seem like the princess... Scratch that, the queen.	3
She seems like a nice girl.	1
It's nice to see two people of different class have a delightful chat.	
Elizabeth	
