
Milky Way	
A player on the other side is on the field with his arms tied up. Let's talk about this with Milky Way.	
I feel like he's mocking us!	-1
It hurts when the whip first crackles. And the pain just keeps ramping up	3
He still has his two legs functioning. I see no problem with that.	1
Milky Way	
Milky Way brought a drink that she says received from the coach on the other team. It looks very suspicious especially with the dark fumes coming out of it.	
The drink looks really scary... But we can't just throw it away...	3
Throw it away. NOW.	
Drink it up!	
Milky Way	
Baltheon, who was upset when he was asked about his past, suddenly started to feel better when he saw Milky Way.	
I think he felt better because of the positive energy you always have around you.	1
Maybe he got embarrased for being obsessed with his past?	
You saved us all from that awkward moment by tripping on your own foot.	
Milky Way	
Milky Way was watching penguins play soccer and suddenly decided to raise a pet penguin herself. Let's talk to her.	
Oh, that'll be so cute!	3
It would be good to have one of each color, and when they're all grown up... Make 'em into a good meal!	
We can play soccer with the penguins!	1
Milky Way	
Milky Way is having trouble with continuing nightmares. Let's talk to her.	
I'll sleep by your side tonight.	3
I see. We must be careful. I'll be watching over you.	
It's just a dream. Forget about it.	
Milky Way	
Milky Way scored a hat trick and led the team to a complete victory! Congratulate her!	
Hmm? Didn't we win the game when we scored the first goal?	3
That was awesome! I'm looking forward to seeing more of that!	-1
You're starting to show the world your true potential! I'm impressed!	1
Milky Way	
Milky Way suggests that we have a team dinner to lighten things up. What will be your reaction?	
How about we go eat salad? I'm on a diet	3
How could you think about eating at a time like this? I'm disappointed in you.	
Good idea. Let's go eat some meat!	1
Milky Way	
Milky Way is angry about the opponent's resilient attack on you. What should we say?	
Don't worry about me! Do your job!	1
Can you peel this guy off of me?	
Don't come over here! It's dangerous!	3
Milky Way	
As Milky Way said, the universe is facing a new course of destiny because of the Galaxy League. Let's talk to her.	
I'm sure it's going in a good direction.	3
I feel like the universe is heading towards chaos.	
It's not the Galaxy League. We are the ones that are leading the fate of this universe.	
Milky Way	
The team will be cleaning up the lodging. What will you have Milky Way do?	
(Give her instructions so that she can do her share of the cleaning quickly.)	1
(Let her take some of the team members and allow them to clean freely)	-1
(Let her clean, but warn her not to cause any trouble.)	3
Milky Way	
Lynia is cleaning the streets with the members of Jeneva Crew. Milky Way is curious and wants to take a look.	
We should probably ignore them and just walk by.	
Let's go help them!	1
The must love volunteer work!	3
Milky Way	
You're watching the storm with Milky Way and you spot Princess Meiran taking a walk while humming.	
Is something troubling her? I'm having a bad feeling.	
What's wrong with her?	
She shines even in the darkest storms! How gorgeous!	3
Milky Way	
Milky Way looks nervous because the team will be moving to the planet where the next match will be held by taking a space shuttle without the help of Littre.	
Did you prepare your meds in case you got space-sick? Never mind, I'll prepare the meds.	3
Don't worry. Leave it up to me.	1
Littre will be fine.	-1
Milky Way	
Milky Way lost to the opponent and fell to the ground. What should we do?	
This doesn't look good...Can anybody give her some heals?	3
Well, this could all have been prevented if you just consumed those Swirlies like I told you...	1
I will avenge you!	
Milky Way	
You visit Marilyn's house and see Hildegard eating ramen.	
Can't you cook ramen by yourself?	
Ramen, that's a dangerous food to cook.	3
Is Marilyn your mother or nanny?	1
Milky Way	
Milky Way falls to the ground after clashing with the opponent. What should we say to her?	
If that's all you've got, just stay down. It's ok.	-1
Get up! The game's not over! You better not give up!	-1
Well, let's start by dropping that player's HP to 1.	3
Milky Way	
Milky Way has shown outstanding performance on both the offensive and defensive side. She is asking for your evaluation on her plays. Let's give her an answer.	
You always seem to find the weak point of the opponent's defense and I love that.	-1
Your attacks are so strong the opponents can't handle it. You should keep that going.	-1
I hope you'd stop sharing small talks with your opponents on the field.	
Milky Way	
Milky Way's opponent is smiling whenever they confront each other on the field. Milky Way seems to be nervous. Let's talk to her.	
That player is just messing with you.	
I think that player likes you.	3
You're doing fine.  Don't play your opponent's game.	
Milky Way	
Milky Way is surrounded by fans and seems to be overwhelmed. Let's talk to her.	
I hope this won't affect your performance on the field.	-1
The fans love your performance!	1
Should've practiced that autograph like I told you.	3
Milky Way	
You come across Milky Way being lost and wandering around while going back to the lodging. Let's talk to her.	
Are you feeling alright?	
Don't use that ability on the field...	3
Don't worry, I'lll go with you.	1
Milky Way	
The next opponent is the Lab Rat Entry. You hear that all of the players on the other team are victims of experiments and this makes you feel uncomfortable.	
That's a sad story. I'm tearing up.	3
I feel bad for them, but that's no excuse for throwing the game.	
It would be rude to them if we don't do our best.	-1
Milky Way	
Milky Way seems to be satisfied with the perfect team work. Let's talk to her.	
It's thanks to you! Thanks for listening to my instructions!	
I'm starting to see true strength in this team.	
Perfect! No mistakes made!	3
Milky Way	
It's a very intense match and Milky Way falls on the ground, but a player on the other team helps Milky Way up and the two exchange smiles.	
Guess the match isn't that tough for you, huh?	
True sportsmanship is Wonderful!	1
That player must have a heart of gold.	3
Milky Way	
The team will not have a match for some time. Milky Way asks you about your plan.	
We could ask one of the top teams for a friendly match.	
Hmm, wanna go shopping?	3
I have a very hard training session all planned up for everybody.	
	
Kei	
The middle fielder on the other team is too powerful. Let's give Kei some orders.	
Pass? Shoot? Forfeit? Argh! Just make a run for it!	
Make him know who he's up against.	3
Let's try out some forward passes.	
Kei	
Kei comes to you and says that he has to leave the team because of personal reasons. What should we say?	
Well, I don't want to be the one holding you back. Good luck!	3
There will always be a place for you to return.	
So, how does this work? Do I tap "Sell"?	
Kei	
You got a couple of tickets to Veronica's live concert. Kei seems to be interested.	
These are for you, of course. Here.	3
We're going to make it fair and gather everyone around so we can draw for the ticket.	
I'll give you this, so get rid of that fake ticket.	
Kei	
Kei doesn't like the new team advertisement video.	
There's not enough fan service.	
It didn't portray your awesome performance.	3
It didn't have to have the bench warmers in the video.	
Kei	
It's Kei's birthday. Let's give him a present.	
Here! I made some cookies with the team.	1
I stole this treasure box from Kuma.	
This is a championship trophy replica for you.  The designs are inspired by you.	3
Kei	
Something must have startled Beelzebub. He has entered the field and is making a scene.	
It's time we use him as training material.	
Stop right there, pig!	
Team! We're having sauteed shredded pork for tonight!	3
Kei	
James is fighting Akane after ambushing Yuri, and Bora is slowly making her approach from a distance.	
...We should get out of here.	
...It's about to go down...! Where's the popcorn?	-1
James and Bora...Who's the villain?	3
Kei	
Kei is asking if you have a special person who you would like to share happy moments with. Let's give him an answer.	
I think that may be you.	3
Every teammate there by my side on the field is special.	1
My Nari dakimakura! She's the best idol in the universe and is super strong.	
Kei	
Kei, who is determined to make everything in his life, even his dreams, about soccer, asks you what it's like to dream about soccer. Let's think about it.	
It was an intense feeling as if I was gonig against the strongest team in the universe.	3
I've never dreamt about soccer.	
I've been chased by a soccer ball monster in my dreams. It was terrifying.	-1
Kei	
Kei is telling a story about how an old kingdom in Valhalla was doomed because of the king.	
I'm sure there were multiple reasons on why the kingdom fell. It's sad to hear such stories.	1
So, is that king entering the Galaxy League?	
Pathetic... That is no king.	3
Kei	
Kei is sad that the World Tree in Umbra has withered. What could we say to cheer him up?	
We'll find the ones that did this and use them as fertilizers.	3
It's a big tree. It'll stand strong.	
Who could've done such a hideous thing?	
Kei	
Kei is wondering why the team is doing so well recently. Pick an answer.	
It's all thanks to you.	3
It's a result of team effort.	
The opponents are mesmerized by the beauty of our players.	
Kei	
With a serious look on his face, Kei warns you to go to the bathroom before the match.	
Bathroom... It is indeed a very important matter...	
Why does an ordinary advice sound so strange..	
I'm surprised you said that. I won't ask what happened to you.	3
Kei	
Preparing for the press conference, you're talking with Kei on which player you think has the brightest future. What will you say?	
You and I are already perfect. So I guess that means we shouldn't be saying our names. 	
I can't pick just one...	
I think it should be you, but will you be able to return to your normal life after all of this is...Wait, I'm going off topic, right? 	-1
Kei	
It seems that Kei is lost in the Nadir forest. What should we do?	
Listen carefully and you'll find him.	-1
Let's ask Khirel to find him...	
Kei? Nah, he never gets lost.	
Kei	
The team is going to go shop. Which group will you join?	
Manga, anime, and figures...! Here I come!	-1
It's time for some good food.	
I guess I can go to the soccer gear shop.	
Kei	
You come across an opponent player limping, because of getting injured during a match against your team. Kei seems to be worried.	
Weakling. Should've been rougher on that player.	
It's unfortunate, but that's something that happened during a match and it's not our fault.	
Let's just go. That player will also feel uncomfortable if we keep standing here.	-1
	
Chitose	
Chitose is stressed out saying her opponent has the upper ground on every aspect. What should we do?	
You can overcome this like always. Right?	
it's not your fault. It's your mistakes that took the opponents off gaurd.	
Let's solve the problems one by one.	1
Chitose	
A teammate that is a former member of the Dark Sisters is down sick, suffering from the aftermath of performing exorcism. Let's talk with Chitose about what to do.	
Let's go visit her. Some fun won't do any harm. It might even cheer her up!	1
Let's leave her alone. She may find all this attention uncomfortable.	
Let's be prepared to take care of her in case her sickness gets worse.	
Chitose	
Chitose's opponent is smiling whenever they confront each other on the field. Chitose seems to be nervous. Let's talk to her.	
That player is just messing with you.	
I think that player likes you.	
You're doing fine.  Don't play your opponent's game.	-1
Chitose	
Chitose is talking about how famous her rivals are in the Galaxy League. She seems jealous. Let's talk to her.	
You're as good as they are, I'd say you deserve more credit.	1
Good rivalry brings both sides to higher levels.	1
I'll be your rival from now.	
Chitose	
It's a tough match, but Chitose is standing tall and encouraging the team. What should we say to her?	
You really help us a lot in these situations.	
You're a good person.	
Your spirit is an inspiration to us all.	3
Chitose	
Chitose seems to be determined to crush the opposing team. Let's give her some advice.	
That's the spirit! Let's teach them a lesson!	3
With your skills and dedication, I have no doubt that you will.	1
I like how you're doing your best.	
Chitose	
You're watching the storm with Chitose and you spot Princess Meiran taking a walk while humming.	
Is something troubling her? I'm having a bad feeling.	
What's wrong with her?	
She shines even in the darkest storms! How gorgeous!	3
Chitose	
You come across Chitose who is limping. She says it's nothing. What should we do?	
I think I'll get injured too if you're on the field. Please sit on the bench.	
Trust me and your teammates. Sit this one out.	1
Don't push yourself too hard. Get off the field if you don't think you can continue.	-1
Chitose	
Chitose refuses to listen to anybody's advice saying he's the best and he doesn't need any advice. Let's talk to her.	
Are you angry because I wasn't there to oversee your training? I said I'm sorry!	
Well that's absolutely fine if you can actually prove that you're the best.	1
That's not like you...	1
Chitose	
Latios is chatting with Chitose after the match. Let's barge in.	
Don't you think about sneaking her out. She's our pretty girl.	3
Chitose was fantastic on the field right?	
I'm looking forward to our next match!	
Chitose	
You visit Marilyn's house and see Hildegard eating ramen.	
Can't you cook ramen by yourself?	
Ramen, that's a dangerous food to cook.	3
Is Marilyn your mother or nanny?	
Chitose	
Chitose seems to be uncomfortable to hear about the love life of other teammates. Let's talk to her.	
It's all good as long as it doesn't affect the match.	
Should we join the club?	3
Just say it. You're jealous.	
Chitose	
Chitose, who has shown absolutely superb chemistry with you, is embarrassed and says she didn't do all of that because of you. What should we say?	
Stop being embarrassed and just accept the compliments, will you?	
Yeah? Well, I did what I did for you	3
Just say it. You're jealous.	
Chitose	
Chitose seems to be interested in the Micrinum from Kiri, which is said to be good for beauty and anti-aging. Let's talk to her.	
I think that's a good choice.	
Looks aren't important when it comes to soccer.	
You're young and good looking even without that.	3
Chitose	
You find Chitose depressed for not playing well during the match. Let's cheer her up.	
Don't mind it. It's our fault. We weren't able to make use of your strength.	-1
You did well and I thank you for that.	1
It's not your fault that you fell during the match. Don't worry about it!	
Chitose	
The members of Siena Celtron are furiously searching the stadium for Kuma.	
Kuma alert! Get back to the shelter!	3
Let's ignore them and get ready for the match.	1
Let's give them a hand.	
Chitose	
Chitose seems to be satisfied with the perfect team work. Let's talk to her.	
It's thanks to you! Thanks for listening to my instructions!	1
I'm starting to see true strength in this team.	1
Perfect! No mistakes made!	
Chitose	
You come across Chitose being lost and wandering around while going back to the lodging. Let's talk to her.	
Are you feeling alright?	
Don't use that ability on the field...	
Don't worry, I'lll go with you.	1
Chitose	
Chitose is interested in Selena and is asking for your opinion. What should we say?	
She's kind and sweet. Maybe you'll have a shot?	
Be honest and show a sincere attitude.	3
Considering your personality, I think she'll accept you.	-1
Chitose	
The opponent team is spreading rumors that they lost because your team played dirty. What should we do?	
Well, you did get ''dirty'' by falling in the dirt.	
We didn't play dirty, right?	1
They will never learn with an attitude like that.	1
Chitose	
The team is at Metro City. Chitose seems to be surprised how the people of Metro City have mechanical bodies.	
I like how they don't mind physical flaws.	
I like how even the minority can be saved in this society.	
You have a heart of gold.	3
Chitose	
Kirin suddenly appears, pats Chitose on the head while teasing her, and then goes away. Chitose seems angry...	
He's like the wind. There wasn't even time to chat.	
...I think you liked it more than you thought...	3
Patting you on the head? He must not fear for his life!	
	
Amaranth	
With a serious face, Amaranth is asking what the true meaning of competition is. Let's give her an answer.	
Being together is enough for me.	-1
A way that a mere high school student can prevent the universe from falling into chaos?	
Well, I'm sure we'll get an answer when we get to the end of this.	
Amaranth	
Amaranth plans to continue playing soccer even after the Galaxy League ends. Let's talk with her.	
I'm thinking of opening a shop.	3
We'll see about it after the Leauge.	
I don't care what I do after the League as long as I get to continue playing soccer.	-1
Amaranth	
You enter the lodging feeling lonely on your birthday. The team greets you with a surprise and Amaranth hands you a present.	
(A cute and pretty pendant)	3
(A surprise box! Inside it there's a cool wallet.)	
(A chocker with a pretty radical design.)	
Amaranth	
Amaranth is suddenly taking interest in who Shootmeister actually is. What should we say?	
I heard he's a super agent from Nebrion.	
All that I care is that he's an excellent trainer.	
I can tell that he's a very dilligent person that always tries his best.	-1
Amaranth	
Amaranth went to take a look at the opponent team and got caught. What should we do?	
We should think about how to make fun of her when she comes back.	
I feel sorry for the other team.	
Amaranth is in danger! We have to save her!	3
Amaranth	
Amaranth looks excited to see a comet shower, which is a rare sight. What should we say to her?	
Where do you think those comets are going?	3
Do you think any of those comets are populated?	
The space has prepared this beatiful stage for you.	
Amaranth	
Amaranth seems to be very confused of how a small soccer ball can change the fate of the universe.	
The fate of the universe is not that simple to be changed by a soccer ball.	-1
Let's open up a bright future with this ball.	1
Look out! (Kicks the ball far away)	
Amaranth	
Amaranth is deeply focused on Jill's diet story. What should we do?	
I don't think you need to worry about diets.	1
You're playing soccer! You're fine!	
Please don't forget about the match.	-1
Amaranth	
Amaranth seems to be lost. She says she no longer hates the rival team.	
I don't see the problem with it as long as it doesn't affect your performance on the field.	
I guess that's natural. The matches against them were great.	1
Is there someone on that team that you like? Go propose!	
Amaranth	
It's a hard match and your team is losing. Talk with Amaranth and talk about what to do.	
We can't give up here. There's still a chance to win this.	-1
I hope they have a "Continue" button around here.	
Let's come up with a plan after this match is over.	
	
Ruen	
You enter the lodging feeling lonely on your birthday. The team greets you with a surprise and Ruen hands you a present.	
(A cute and pretty pendant)	
(A surprise box! Inside it there's a cool wallet.)	3
(A chocker with a pretty radical design.)	
Ruen	
Ruen looks excited as she's talking with the team about pets. She turns around and asks you what kind of pet you like.	
I think that a baby duck following its mother is one of the most adorable things to watch.	
I like puppies. The loyal ones!	
I like cats. I like the egoistic side of them.	1
Ruen	
It suddenly began to rain heavily. You see Ruen running up ahead.	
(Catch up and share your umbrella.)	3
(Let her steal your umbrella.)	
(Run past her and smile.)	
Ruen	
Kuma is caught sneaking in the woman's locker room once again. We should talk with Ruen about what to do with him.	
Let's make him put on Ogre's underwear.	-1
Let's make him put on Renee's underwear.	
I'm not sure if it's save, but we can use him for leveling up.	
Ruen	
Ruen went to take a look at the opponent team and got caught. What should we do?	
We should think about how to make fun of her when she comes back.	
I feel sorry for the other team.	1
Ruen is in danger! We have to save her!	-1
Ruen	
Ruen is asking for special training sessions because she's not satisfied with today's performance. What should we tell her?	
Good. I'll train you until you can't stand up.	
If that's your wish.	
Sure. Let's get on to it.	1
Ruen	
Ruen did her best, but she failed to achieve the results she wanted and looks sad. We should say something to her.	
Sorry, I feel that this is on me.	
That wasn't enough! You have to try harder!	
It's experiences like this that bonds us together.	3
Ruen	
Ruen is getting suspicious about how all the Gate Keepers are in the form of different animals.	
Do you think they'll be tasty?	
I think they're cute and elegant if you leave out the pig and bear. 	1
I'd like to keep one as a pet. 	
Ruen	
Ruen is deeply focused on Jill's diet story. What should we do?	
I don't think you need to worry about diets.	1
You're playing soccer! You're fine!	
Please don't forget about the match.	
Ruen	
Ruen is having a delightful chat with a girl that's holding a turtle.	
You seem like the princess... Scratch that, the queen.	
She seems like a nice girl.	
It's nice to see two people of different class have a delightful chat.	3
Ruen	
Ruen is furious about the referee that's clearly favoring the other team. Should we stop her?	
(Step on the referee's foot and pretend it was an accident.)	
The tougher it gets, the better it feels to win. Right?	1
Ignore the referee. Focus on the match.	
Ruen	
Ruen looks excited to see a comet shower, which is a rare sight. What should we say to her?	
Where do you think those comets are going?	
Do you think any of those comets are populated?	
The space has prepared this beautiful stage for you.	-1
Ruen	
During the team meeting, you find a player sleeping. What should you do?	
(Leave it to Ruen.)	1
(Slap the player in the back of the head.)	
(Wake the player up and continue with the meeting.)	
Ruen	
Ruen seems very nervous to confront Kei of the Rescuer.	
Be careful not to be stomped on...	
We can do this! Let's go!	1
Don't be nervous! Don0t you trust your teammates?	
Ruen	
It's dinner time and Ruen is staring at her carrot soup with a troubled look. What should we do?	
(Eat it instead of her).	
(Tell her to put the carrots in the soup on Hildegard's plate)	-1
(Tell her that carrots are good for the body and to eat it all)	
Ruen	
Ruen wants to know what the Swirlies really are. Give her an answer.	
Beginner level monster in an RPG Game.	
Thankful beings that will be our +160.	1
I'm planning to make a whole line of merchandise with them as the character.	
	
Silla	
Silla is questioning Kuma's status as a Gate Keeper.	
He's just material for leveling up.	-1
I like how all Gate Keepers have different characteristics.	3
That bear...Is a hero...!	-1
Silla	
Silla is getting slow on the field and this is causing trouble. Let's talk with Silla.	
I think we should come up with an action speed deck or go for counterattacks...	
I'll try to have the ball come your way.	
We can overcome this with team effort	3
Silla	
The team made it up to the semi-finals after counting the goal differences. Silla asks how you feel. How should we answer?	
What, are you expecting something like "I feel like I can fly" or something?	-1
This is where things get serious. We're going for the win!	1
Wow. I'm sooooo happy.	3
Silla	
Silla is surrounded by fans and seems to be overwhelmed. Let's talk to her.	
I hope this won't affect your performance on the field.	-1
The fans love your performance!	
Should've practiced that autograph like I told you.	3
Silla	
Silla is telling a story about how an old kingdom in Valhalla was doomed because of the king.	
I'm sure there were multiple reasons on why the kingdom fell. It's sad to hear such stories.	3
So, is that king entereing the Galaxy League?	-1
Pathetic... That is no king.	
Silla	
The team will not have a match for some time. Silla asks you about your plan.	
We could ask one of the top teams for a friendly match.	-1
Hmm, wanna go shopping?	3
I have a very hard training session all planned up for everybody.	-1
Silla	
Silla falls to the ground after clashing with the opponent. What should we say to her?	
If that's all you've got, just stay down. It's okay.	-1
Get up! The game's not over! You better not give up!	-1
Well, let's start by dropping that player's HP to 1.	3
Silla	
It's a very intense match and Silla falls on the ground, but a player on the other team helps Silla up and the two exchange smiles.	
Guess the match isn't that tough for you, huh?	-1
True sportsmanship is Wonderful!	1
That player must have a heart of gold.	3
Silla	
Silla scored a hat trick and led the team to a complete victory! Congratulate her!	
Hmm? Didn't we win the game when we scored the first goal?	3
That was awesome! I'm looking forward to more of that!	-1
You're starting to show the world your true potential! I'm impressed!	
Silla	
Silla is impressed by the help she received from the elementals. Let's talk to her.	
The only problem is that they take up a lot of space in the inventory.	
I feel like the whole universe is cheering for us when we're with the elementals!	
I am so thankful to them.	3
Silla	
Silla has shown outstanding performance on both the offensive and defensive side. She is asking for your evaluation on her plays. Let's give her an answer.	
You always seem to find the weak point of the opponent's defense and I love that.	-1
Your attacks are so strong the opponents can't handle it. You should keep going.	-1
I hope you'd stop sharing small talks with your opponents on the field.	3
Silla	
