
I'm disappointed, too. Let's start over.	3
Just please go with that boring strategy.	
Bell	
You were taking a walk in the Nadir forest with Bell and came across Enthia standing in the middle of a burnt part of the forest.	
Lets give her some space	
I could really use some grilled sweet potatoes and chestnuts	
Theres not time for tears! Find out who did this and bring justice!	-1
Bell	
Bell seems to be very confused of how a small soccer ball can change the fate of the universe.	
The fate of the universe is not that simple to be changed by a soccer ball.	1
Let's open up a bright future with this ball.	3
Look out! (Kicks the ball far away)	-1
Bell	
Bell seems to be upset about losing a body check against her opponent.	
Let's make an armor out of Spirit Stones.	
Maybe if you increase your Strength...	
Don't be weak.	3
Bell	
With a serious face, Bell is asking what the true meaning of competition is. Let's give her an answer.	
Being together is enough for me.	3
A way that a mere high school student can prevent the universe from falling into chaos?	1
Well, I'm sure we'll get an answer when we get to the end of this.	
Bell	
According to Bell's words, Tyler went to school 1 year earlier than William.	
I want to see Tyler's true characteristics.	1
William doesn't know how to respect his seniors.	
I thought they were just friends.	3
Bell	
The opponent team barges into the field and mocks your team saying your team is better off playing foot volleyball.	
Let's see what you have to say after the match.	3
I didn't know I was a talented foot volleyball player!	1
Care to receive the ball with your face?	
Bell	
Bell is looking excited and asks how the match went.	
The other team went home crying!	-1
They were a worthy opponent.	3
I led our team to victory with wedgies!	-1
Bell	
Bell suggests that we visit the Celestial Castle, which is a place that the baby angels live.	
What's the agenda here? Are you trying to taint the pure angels?	-1
This is a good chance to show the baby angels how rough soccer can be!	
That would be wonderful! I'll go ask for permission.	3
Bell	
With back to back matches, the team is exhausted. Let's talk to Bell for solutions.	
We won't be able to win the league if we fail to overcome this.	1
I guess it's time the benchwarmers get a change.	3
How about we put the advantaged technology of Metro City to use?	-1
Bell	
You're talking to Bell about what you would do if the world ends tomorrow. Let's tell her your answer.	
I would say goodbye to all my friends.	3
If it's the end of the world, I'd pull of a crazy performance in a densely populated area before I go!	
Hmm, there's a guy I'd like to beat up before I die.	1
Bell	
Your team is playing against the Scout Entries and Malcolm seems to be enjoying himself a little too much. Bell is starting to get intimidated.	
Okay, it's time we take this match seriously.	3
He's obviously obsessed with soccer.	
This is good. We can use this chance to break their back line.	1
Bell	
You were enjoying the peaceful day on Earth until the Peacemakers suddenly showed up. At that moment, the Magical Girl Elements came to save the day!	
Cool! Awesome!	1
Oh, come on! Where's the transformation scene?!	
...Uh...So no soccer?	3
Bell	
The match started and Bell is standing still doing nothing.	
What is she doing? Is she a totem?	1
Run! Just start running!	
Looks like we'll have to do without her.	3
Bell	
Bell is asking what the conditions of a team ace are with a serious face. Let's talk with her.	
Just act like yourself. You're already the ace.	3
Well, having a good ace skill is a start.	
Flawless skills.	
Bell	
Bell is suddenly taking interest in who Shootmeister actually is. What should we say?	
I heard he's a super agent from Nebrion.	-1
All that I care is that he's an excellent trainer.	1
I can tell that he's a very diligent person that always tries his best.	3
Bell	
Bell is complaining about restricted from playing the next match for receiving too many fouls. Let's talk to her.	
It's the consequences of your actions. Accept it.	3
I feel sorry for you and ency you at the same time.	-1
Use this as a chance to enhance your condition.	1
Bell	
Bell is worried about all of the powerful beings that will be competing in the Galaxy League. Let's say something to her.	
It's only a sport! The strongest team wins, and we are strong!	1
I'm sure everybody is feeling the same way you feel.	3
Aren't you the one everybody should be afraid of?	-1
Bell	
The team is having a good run and Bell is sure that winning the League is a matter of time.	
Let's keep this momentum going!	3
As long as we're not used as training material...	
There's still a lot of obstacles ahead.	
Bell	
Bell is training hard to become scouted like the players that moved to teams that offered better conditions. Let's give her some advice.	
I hope you get scouted by an interesting team.	
Make the scouters fall in love with your performance!	
Let's make that our goal and make it happen.	3
Bell	
The team manger ran away with all of the team's money. What should we do?	
We could start a reset marathon.	1
We're going to hunt that manager down and take back our money. We will show no mercy!	
Let's ask for help to the League officials on this planet.	3
Bell	
You're at the Yggdrasil memorial ceremony. The Yggdrasil Guardians are parading through the festive crowd.	
If this is how they do a memorial in Valhalla, it's natural to understand and accept.	1
I think it's a nice way to cherish the memories of the lost.	3
Maybe it was a good thing? I mean they say it's a tragedy, but look at how joyful it is.	
Bell	
The match and the concert that Bell was looking for start at the same time...	
Let's hack the big screen so we can see the concert!	
Channel that sorrow and rag towards your opponents and make them pay.	-1
I'm sorry that you couldn't go.	3
Bell	
Bell won a trip around the world from a radio event!	
What about soccer? You'll have to go through me to go on that trip!	-1
Hmm, come back to me with a vacation plan.	3
...World? What about space? Isn't that more interesting?	1
Bell	
Bell's form has been improving rapidly. She says she can't wait for the next match. What should we say to her?	
If you keep it up like that you'd be able to play superbly in any position.	1
Remember that feeling and use it when things get rough.	3
Consumed a lot of Swirlies, I see.	
Bell	
Bell seems to be lost. She says she no longer hates the rival team.	
I don't see a problem with it as long as it doesn't affect your performance on the field.	1
I guess that's natural. The matches against them were great.	3
Is there someone on the team that you like? Go propose!	
Bell	
The team is in a slump and you take the team out for refreshment. Talk with Bell to set some simple rules.	
This team is a mess. Gather everybody of the field. I'll knock that spirit back into you guys if I have to.	-1
Let's split up and meet back here for dinner. Tell everybody to enjoy their free time.	
Come on, I'll show you the best spots around.	
Bell	
During a match, Bell bumped into a teammate and knocked the player out. She seems depressed. What should we say to cheer her up?	
Wasn't that a glitch?	-1
We have to keep on going.	1
It's something that happened during the match. Don't be so hard on yourself.	3
Bell	
It's a hard match and your team is losing. Talk with Bell and talk about what to do.	
We can't give up here. There's still a chance to win this.	3
I hope they have a "Continue" button around here.	-1
Let's come up with a plan after this match is over.	
Bell	
Bell wonders why Castor twitches whenever he sees Beatrice.	
Long ago, he was disgraceful towards a dragon emissary.	3
The character story left him a trauma.	
Maybe he just wants to duke it out.	-1
Bell	
Bell thinks she knows who Lynbell's brother is. What should we do?	
First, let's look for a way to bring him back to normal.	3
Of course we should tell Lynbell! What are you waiting for?	-1
...Sometimes, the truth is better to be left a secret.	-1
Bell	
Bell is curious of the whereabouts of the managers that are nowhere to be seen during the match. Let's give her an answer.	
They're on cooldown.	-1
They support us from the shadows.	1
Even if they're not on the field with us, we're fighting as one. Right?	3
Bell	
Bell plans to continue playing soccer even after the Galaxy League ends. Let's talk with her.	
I'm thinking of opening a shop.	-1
We'll see about it after the League.	
I don't care what I do after the League as long as I get to continue playing soccer.	3
Bell	
You're sick and in bed when Bell and the teammates come to cheer you up. What will your response be?	
You guys... I'm about to cry...	
I'm sorry... I should be giving you guys some tea or something, but...	3
Get closer so I can spread my germs!	
Bell	
Nari is dancing and singing a song about the galaxy.	
The stage is so majestic! It's awesome!	
This proves that even the aliens like Nari.	3
I think she's something more than just an idol.	
Bell	
Vitos suddenly laughs in joy during the match against the Empire. Why?	
The emperor of demons is also enjoying this match!	3
Has he gone mad?	
I guess he's happy this is a good match.	1
Bell	
Bell seems to be lost after having a good match while her fortune-telling said things would go wrong. Let's talk to her.	
They say the fortune-telling is inaccurate if you don't pay a sufficient price.	
It's just a myth. Forget about it.	1
Game results aren't that simple to be predicted by fortune-telling.	3
Bell	
MX54 Butcher is closing in on a cat with a suspicious smile.	
Stop right there!	-1
Excuse me, but do you have an appointment with that cat?	3
...Maybe he just likes cats!	1
Bell	
Bell isn't pleased with the team's recent plays. She feels that the plays have become somewhat repetitive and dull.	
Let's all talk together and figure out what the problem is.	3
Let's invest some crystals and get new players!	1
We may have to go rough on the team and make them realize the problem.	-1
Bell	
This was the worst game in your entire life...Bell comes to you to cheer you up.	
Please explain why you kicked the ball into our goal post, will you?	
Thanks...I know you're the one that's the most devastated...Let's do better next time.	
Thanks. You always know how to get me back on my feet.	3
	
Cashlove	
You come across Cashlove being lost and wandering around while going back to the lodging. Let's talk to her.	
Are you feeling alright?	
Don't use that ability on the field...	
Don't worry, I'll go with you.	-1
	
Chiffon	
Chiffon picked up a diary. It says Bell on the cover.	
So, this is how the revelation begins!	
Oh, I'm sure going to read this! That's a joke, of course...	3
Let's contact her and return this.	
Chiffon	
Chiffon is curious about the Galaxy League. What answer will help her?	
It's the place where the chosen ones learn about their destiny.	
It's the place of dreams colliding.	3
It's stressful because we can't prepare for extraterrestrial sanitation. We're completely exposed to all those unknown...things.	
Chiffon	
Chiffon is asking what the conditions of a team ace are with a serious face. Let's talk with her.	
Just act like yourself. You are already the ace.	
Well, having a good ace skill is a start.	1
Flawless skills.	
Chiffon	
The rain has messed up the field and the enemy team seems to be determined to crush your team.	
I can't stand this...I need to end this quickly and go take a shower.	
What a depressing weather...	
Well, if it's a muddy dog fight they want, let's give it to them!	3
Chiffon	
It's a throwing chance, but the opponent team player suddenly jumps in joy saying his baby brother is born. What should you do?	
I could throw the ball and continue the match, but my honor wouldn't allow that.	
I guess I finally get to meet my archnemesis.	
Wow, congratulations! (claps)	3
Cynthia	
Kirin suddenly appears, pats Cynthia on the head while teasing her, and then goes away. Cynthia seems angry...	
He's like the wind. There wasn't even time to chat.	
...I think you liked it more than you thought...	
Patting you on the head? He must not fear for his life!	1
Cynthia	
A teammate that is a former member of the Dark Sisters is down sick, suffering from the aftermath of performing exorcism. Let's talk with Cynthia about what to do.	
Let's go visit her. Some fun won't do any harm. It might even cheer her up!	3
Let's leave her alone. She may find all this attention uncomfortable.	
Let's be prepared to take care of her in case her sickness gets worse.	1
Cynthia	
It's a tough match, but Cynthia is standing tall and encouraging the team. What should we say to her?	
You really help us a lot in these situations.	
You're a good person.	
Your spirit is an inspiration to us all.	3
Cynthia	
The team made it up to the semi-finals after counting the goal differences. Cynthia asks how you feel. How should we answer?	
What, are you expecting something like "I feel like I can fly" or something?	3
This is where things get serious. We're going for the win!	
Wow. I'm sooooo happy.	
Cynthia	
Cynthia was watching penguins play soccer and suddenly decided to raise a pet penguin herself. Let's talk to her.	
Oh, that'll be so cute!	-1
It would be good to have one of each color, and when they're all gown up...Make 'em into a good meal!	3
We can play soccer with the penguins!	-1
Cynthia	
Lynia is cleaning the streets with the members of Jeneva Crew. Cynthia is curious and wants to take a look.	
We should probably ignore them and just walk by.	3
Let's go help them!	-1
They must love volunteer work!	-1
Cynthia	
Cynthia seems to be interested in the Micrinum from Kiri, which is said to be good for beauty and anti-aging. Let's talk to her.	
I think that's a good choice.	
Looks aren't important when it comes to soccer.	
You're young and good looking even without that.	3
Cynthia	
The team is at Metro City. Cynthia seems to be surprised how the people of Metro City have mechanical bodies.	
I like how they don't mind physical flaws.	
I like how even the minority can be saved in this society.	
You have a heart of gold.	3
Cynthia	
Cynthia is furious about how Lucian is always surrounded by girls. What should we say?	
Are you jealous?	3
He's popular, just not as much as me.	
He's good looking and has a good personality. Maybe that's why.	
Cynthia	
Cynthia suggests that we have a team dinner to lighten things up. What will be your reaction?	
How about we go eat salad? I'm on a diet.	-1
How could you think about eating at a time like this? I'm disappointed in you.	3
Good idea. Let's go eat some meat!	-1
Cynthia	
Cynthia is impressed by the help she received from the elementals. Let's talk to her.	
The only problem is that they take up a lot of space in the inventory.	3
I feel like the whole universe is cheering for us when we're with the elementals.	-1
I am so thankful to them.	
Cynthia	
Cynthia looks disappointed about the size of the Galaxy League. What would be an appropriate response?	
Nervous? Trust me. I got you.	3
What were you expecting? An intergalactic war?	-1
Isn't it awesome to see the galaxy come together for soccer?	
Cynthia	
A player on the other side is on the field with his arms tied up. Let's talk about this with Cynthia.	
I feel like he's mocking us!	1
It hurts when the whip first crackles. And the pain just keeps ramping up.	
He still has his two legs functioning. I see no problem with that.	
Cynthia	
Cynthia falls to the ground after clashing with the opponent. What should we say to her?	
If that's all you've got, just stay down. It's okay.	
Get up! The game's not over! You better not give up!	-1
Well, let's start by dropping that player's HP to 1.	-1
Cynthia	
The next opponent is the Lab Rat Entry. You hear that all of the players on the other team are victims of experiments and this makes you feel uncomfortable.	
That's a sad story. I'm tearing up.	
I feel bad for them, but that's no excuse for throwing the game.	3
It would be rude to them if we don't do our best.	
Cynthia	
You're walking in a narrow ally and come across Cynthia having an intense staring contest with the captain of the opposing team. What should we say?	
Save the energy for the match.	-1
How about solving this with a game of rock, scissors, paper?	
...I see two idiots standing in front of me...	3
Cynthia	
Cynthia lost to the opponent and fell to the ground. What should we do?	
This doesn't look good...Can anybody give her some heals?	
Well, this could have been prevented if you just consumes those Swirlies like I told you...	3
I will avenge you!	
Cynthia	
The team seems very nervous facing Skalardra. What should we do?	
Hmm? What's wrong everybody?	
Political power means nothing on the field.	
Huh? I think Cynthia is prettier.	3
Cynthia	
Cynthia is interested in Selena and is asking for your opinion. What should we say?	
She's kind and sweet. Maybe you'll have a shot?	
Be honest and show a sincere attitude.	3
Considering your personality, I think she'll accept you.	
Cynthia	
Cynthia is asking you what you think is it that makes this team great. You weren't expecting this, but you should give her an answer.	
We have a strong lineup of players that make our star players shine brighter.	
Well, you're looking at the one person that is making this team great.	
You. I know you're doing much for the team without taking any credit.	3
Cynthia	
Cynthia scored a hat trick and led the team to a complete victory! Congratulate her!	
Hmm? Didn't we win the game when we scored the first goal?	
That was awesome! I'm looking forward to seeing more of that!	3
You're starting to show the world your true potential! I'm impressed!	
Cynthia	
Cynthia seems to be uncomfortable to hear about the love life of other teammates. Let's talk to her.	
It's all good as long as it doesn't affect the match.	1
Should we join the club?	3
Just say it. You're jealous.	1
Cynthia	
Cynthia has shown outstanding performance on both the offensive and defensive side. She is asking for your evaluation on her plays. Let's give her an answer.	
You always seem to find the weak point of the opponent's defense and I love that.	3
Your attacks are so strong the opponent can't handle it. You should keep that going.	
I hope you're sharing small talks with your opponents on the field.	
Cynthia	
Cynthia wants to have an academic conversation about the 5th dimension, string theory, and other infamously hard space theories. Why...?	
(She wants you to be a good listener.)	1
(There must be a reason why she started this conversation.)	1
(Maybe she brought snacks but is too shy to share it with me.)	3
Cynthia	
Cynthia is talking about how famous her rivals are in the Galaxy League. She seems jealous. Let's talk to her.	
You're as good as they are, I'd say you deservee more credit.	1
Good rivalry brings both sides to higher levels.	1
I'll be your rival from now.	
Cynthia	
Cynthia seems to be determined to crush the opposing team. Let's give her some advice.	
That's the spirit! Let teach them a lesson!	3
With your skills and dedication, I have no doubt that you will.	1
I like how you're doing your best.	
Cynthia	
Cynthia looks sad because she feels her friendship with a friend in a rival team is falling apart. What should we say to her?	
It's not your fault. Let's try to find out why this is happening.	
Try starting off with some small talk.	3
If your friend is truly your friend, she will understand.	
Cynthia	
Cynthia is spreading the happy news about her cousin having a baby. Let's congratulate her.	
Congratulation!	
So, the numerous baby clothes you've been making were all for this day ?	3
I hope that baby comes to be a great soccer player, just like you.	-1
Cynthia	
The team will not have a match for some time. Cynthia asks you about your plan.	
We could ask one of the top teams for a friendly match.	
Hmm, wanna go shopping?	
I have a very hard training session all planned up for everybody.	3
Cynthia	
Kuma is furiously chasing Ogre. Cynthia seems confused.	
Two bears...Which one is Kuma?	
Well, one thing is for sure. One of them did something stupid.	1
Looks like Orge is goofing around. I mean the guy has like over 200 pounds over Kuma.	
	
Freyja	
The middle fielder on the other team is too powerful. Let's give Freyja some orders.	
Pass? Shoot? Forfeit? Argh! Just make a run for it!	-1
Make him know who he's up against	-1
Let's try out some forward passes	3
Freyja	
It's a very intense match and Freyja falls on the ground, but a player on the other team helps Freyja up and the two exchange smiles.	
Guess the match isn't that tough for you, huh?	
True sportsmanship! Wonderful!	
That player must have a heart of gold! 	3
Freyja	
As Freyja said, the universe is facing a new course of destiny because of the Galaxy League. Let's talk to her.	
I'm sure it's going in a good direction.	3
I feel like the universe is heading towards chaos.	
It's not the Galaxy League. We are the ones that are leading the fate of this universe.	-1
Freyja	
Freyja falls to the ground after clashing with the opponent. What should we say to her?	
If that's all you've got, just stay down. It's okay.	
Get up! The game's not over! You better not give up!	
Well, let's start by dropping that player's HP to 1.	3
Freyja	
Freyja scored a hat trick and led the team to a complete victory! Congratulate her!	
Hmm? Didn't we win the game when we scored the first goal?	
That was awesome! I'm looking forward to seeing more of that!	-1
You're starting to show the world your true potential! I'm impressed!	
Freyja	
Freyja is getting slow on the field and this is causing trouble. Let's talk with Freyja.	
I think we should come up with an action speed deck or go for counter attacks...	
I'll try to have the ball come your way	1
We can overcome this with team effort.	-1
Freyja	
Freyja doesn't like the new team advertisement video.	
There's not enough fan service.	
It didn't portray your awesome performance.	1
It didn't have to have the bench warmers in the video.	
Freyja	
It's Freyja's birthday. Let's give her a present.	
Here! I made some cookies with the team.	1
I stole this treasure box from Kuma.	
This is a championship trophy replica for you. The designs are inspired by you.	1
Freyja	
Freyja is worried that she has to face demons, black holes and other dangerous things. What should we tell her?	
Look at the beautiful players! This is paradise!	
You're the most dangerous of them all.	1
Makes it worth the challenge, don't you think so?	-1
Freyja	
You hear that the opponent team's ace, who is also Freyja's rival, has been severely injured and is in the hospital. What should you say to her?	
Sorry for the bad news. Do you want to pay a visit?	-1
This is our chance to steal his precious collection.	
This wont be the end of your rival.	-1
Freyja	
Freyja is wondering why the team is doing so well recently. Pick an answer.	
It's all thanks to you.	1
It's a result of team effort.	
The opponents are mesmerized by the beauty of our players.	
Freyja	
Freyja is sad that the World Tree in Umbra has withered. What could we say to cheer her up?	
We'll find the ones who did this and use them as fertilizers.	-1
It's a big tree. It'll stand strong.	
Who could have done such a hideous thing?	
Freyja	
Freyja says she wants to cry because the goal keeper on the other team just won't go down no matter how many shots she makes.	
Let's start by picking ther defense apart.	
Let's come up with a new strategy to give you more synergy.	
I'll come up with a formation that can bring the best out of everybody.	-1
Freyja	
Freyja brought a drink that she says received from the coach on the other team. It looks very suspicious especially with the dark fumes coming out of it.	
The drink looks really scary...But we can't just throw it away...	
Throw it away. NOW.	-1
Drink it up!	
Freyja	
The team made it up to the semi-finals after counting the goal differences. Freyja asks how you feel. How should we answer?	
What, are you expecting something like "I feel like I can fly" or something?	
This is where things get serious. We're going for the win!	1
Wow. I'm sooooo happy.	
Freyja	
Freyja wants the team to enter the Underground League on Earth. What should we do?	
That seems like a dangerous idea... Let's not make any quick decisions.	
What about just watching?	
Sure. Let's beat them all and take the prize money!	-1
Freyja	
Mimi continues to praise Princess Meiran and it's likely that this isn't going to end any time soon. Freyja seems to be sick of this.	
Okay! Now I'll tell you all the good stuff about Freyja!	
Iron Claw!	
Oh, there's Princess Meiran! (Runs away)	3
Freyja	
Freyja is making a scene about the women's uniform and underwear disappearing. Let's talk to her.	
I want you to form a team and catch every single bear near this locker room.	
...If you want to say something, it's alright. I'll be listening.	3
Let's go tell the manager.	-1
Freyja	
Freyja is asking if you have a special person who you would like to share happy moments with. Let's give her an answer.	
I think that may be you.	
Every teammate there by my side on the field is special.	-1
My Nari dakimakura! She's the best idol in the universe and is super strong.	
Freyja	
A teammate is being stubborn about going out on the field while having a very severe fever. What should we do?	
I'll tackle him down! Knock his lights out!	
Don't kill him, okay?	-1
We're taking him to the doctor even if that means by force. Help me.	
Freyja	
Preparing for the press conference, you're talking with Freyja on which player you think has the brightest future. What will you say?	
You and I are already perfect. So I guess that means we shouldn't be saying our names.	
I can't just pick one...	-1
I think it should be you, but will you be able to return to your normal life after all of this...Wait, I'm going off topic, right?	3
Freyja	
The next opponent is the Lab Rat Entry. You hear that all of the players on the other team are victims of experiments and this makes you feel uncomfortable.	
That's a sad story. I'm tearing up.	
